sku,name,search
48-75,Space Marines Primaris Intercessors,Space Marines Primaris Intercessors
40-04,Warhammer 40000 Introductory Set,Warhammer 40k Introductory Set
80-15,Age Of Sigmar Introductory Set,Age Of Sigmar Introductory Set
48-37,Space Marines Gladiator,Space Marines Gladiator
89-29,Orruk Warclans Orruk Brutes, Warclans Orruk Brutes
48-71,Space Marines Primaris Reivers,Space Marines Primaris Reivers
92-14,Sylvaneth Tree-Revenants,Sylvaneth Tree-Revenants
48-63,Space Marines Primaris Librarian,Space Marines Primaris Librarian
43-48,Death Guard Plague Marine Champion,Death Guard Plague Marine Champion
51-44,Genestealer Cults Biophagus,Genestealer Cults Biophagus
89-57,Orruk Warclans Ardboy Big Boss,Orruk Warclans Ardboy Boss